{
    "id": 9,
    "container.type": "dashboard",
    "visualization.name": "TopN Area Chart - Monitor Uptime",
    "visualization.description": "Displays top N monitor uptime percent using an area chart.",
    "visualization.granularity": "10 m",
    "visualization.timeline": {
        "relative.timeline": "today",
        "visualization.time.range.inclusive": "no"
    },
    "visualization.category": "TopN",
    "visualization.type": "Area",
    "visualization.data.sources": [
        {
            "type": "availability",
            "filters": {
                "data.filter": {},
                "result.filter": {},
                "drill.down.filter": {}
            },
            "data.points": [
                {
                    "data.point": "monitor.uptime.percent",
                    "aggregator": "avg"
                }
            ],
            "visualization.result.by": [
                "monitor"
            ]
        }
    ],
    "visualization.properties": {
        "chart": {
            "chart.legend": "no",
            "vertical.legend": "no",
            "chart.label": "no",
            "highchart.settings": {},
            "sorting": {
                "limit": 10,
                "order": "desc",
                "column": "monitor.uptime.percent.avg"
            }
        }
    },
    "visualization.result.by": [
        "monitor"
    ]
}