{
  "id": 10,
  "container.type": "dashboard",
  "visualization.name": "TopN Area Chart - Volume Bytes (Flow)",
  "visualization.description": "Displays top N volume bytes using an area chart (flow type).",
  "visualization.granularity": "10 m",
  "visualization.timeline": {
    "relative.timeline": "today",
    "visualization.time.range.inclusive": "no"
  },
  "visualization.category": "TopN",
  "visualization.type": "Area",
  "visualization.data.sources": [
    {
      "type": "flow",
      "filters": {
        "data.filter": {},
        "result.filter": {},
        "drill.down.filter": {}
      },
      "data.points": [
        {
          "data.point": "volume.bytes",
          "aggregator": "sum"
        }
      ],
      "visualization.result.by": [
        "source.ip",
        "destination.ip"
      ]
    }
  ],
  "visualization.properties": {
    "chart": {
      "chart.legend": "no",
      "vertical.legend": "no",
      "chart.label": "no",
      "highchart.settings": {},
      "sorting": {
        "limit": 10,
        "order": "desc",
        "column": "volume.bytes.sum"
      }
    }
  },
  "visualization.result.by": [
    "source.ip",
    "destination.ip"
  ]
} 