{
    "id": 11,
    "container.type": "dashboard",
    "visualization.name": "TopN Area Chart - Policy Severity (Metric)",
    "visualization.description": "Displays top N policy severity (metric category) using an area chart.",
    "visualization.granularity": "10 m",
    "visualization.timeline": {
        "relative.timeline": "today",
        "visualization.time.range.inclusive": "no"
    },
    "visualization.category": "TopN",
    "visualization.type": "Area",
    "visualization.data.sources": [
        {
            "type": "policy",
            "category": "metric",
            "filters": {
                "data.filter": {},
                "result.filter": {},
                "drill.down.filter": {}
            },
            "data.points": [
                {
                    "data.point": "severity",
                    "aggregator": "count"
                }
            ],
            "visualization.result.by": [
                "object.id"
            ]
        }
    ],
    "visualization.properties": {
        "chart": {
            "chart.legend": "no",
            "vertical.legend": "no",
            "chart.label": "no",
            "highchart.settings": {},
            "sorting": {
                "limit": 10,
                "order": "desc",
                "column": "severity.count"
            }
        }
    },
    "visualization.result.by": [
        "object.id"
    ]
}