{
    "id": 8,
    "container.type": "dashboard",
    "visualization.name": "TopN Area Chart - Message Count (Log)",
    "visualization.description": "Displays top N message count using an area chart (log type).",
    "visualization.granularity": "10 m",
    "visualization.timeline": {
        "relative.timeline": "today",
        "visualization.time.range.inclusive": "no"
    },
    "visualization.category": "TopN",
    "visualization.type": "Area",
    "visualization.data.sources": [
        {
            "type": "log",
            "filters": {
                "data.filter": {},
                "result.filter": {},
                "drill.down.filter": {}
            },
            "data.points": [
                {
                    "data.point": "message",
                    "aggregator": "count"
                }
            ],
            "visualization.result.by": [
                "event.source.type"
            ]
        }
    ],
    "visualization.properties": {
        "chart": {
            "chart.legend": "no",
            "vertical.legend": "no",
            "chart.label": "no",
            "highchart.settings": {},
            "sorting": {
                "limit": 10,
                "order": "desc",
                "column": "message.count"
            }
        }
    },
    "visualization.result.by": [
        "event.source.type"
    ]
}