{
    "id": 6,
    "container.type": "dashboard",
    "visualization.name": "TopN Solid Gauge View - Memory Utilization",
    "visualization.description": "Displays top N memory utilization using a solid gauge view.",
    "visualization.granularity": "10 m",
    "visualization.timeline": {
        "relative.timeline": "today",
        "visualization.time.range.inclusive": "no"
    },
    "visualization.category": "TopN",
    "visualization.type": "TopN Solid Gauge View",
    "visualization.data.sources": [
        {
            "type": "metric",
            "filters": {
                "data.filter": {},
                "result.filter": {},
                "drill.down.filter": {}
            },
            "data.points": [
                {
                    "data.point": "system.memory.used.percent",
                    "aggregator": "avg"
                }
            ],
            "visualization.result.by": [
                "monitor"
            ]
        }
    ],
    "visualization.properties": {
        "chart": {
            "chart.legend": "no",
            "vertical.legend": "no",
            "chart.label": "no",
            "highchart.settings": {},
            "sorting": {
                "limit": 10,
                "order": "desc",
                "column": "system.memory.used.percent.avg"
            }
        }
    },
    "visualization.result.by": [
        "monitor"
    ]
}